<?xml version="1.0" encoding="UTF-8"?>

<root
    xmlns:xsi='http://www.w3.org/2001/XMLSchema-instance'
    xmlns='http://luoying.huliqing.name'
    xsi:schemaLocation='http://luoying.huliqing.name ../../../../ly-kernel/src/LuoYing/Data/meta/state.xsd'>
    
    <!-- ====================================================================-->
    <!--状态: 
    1.状态只对拥有状态的角色产生影响，不对其它目标产生作用。
    2.状态可以用来临时改变角色的各种属性值或行为
    3.状态是动态的，会有时间限制,一般在状态结束时应该恢复角色的原始状态。
    -->
    <!-- ====================================================================-->
    
    <!--测试用-->
    <stateGroup id="stateGhostTest" icon="" useTime="30" states="stateGhostTest1,stateGhostTest2,stateGhostTest3" />
    <stateAttribute id="stateGhostTest1" useTime="30" attributeName="attributeGhostRate" value="1" restore="1" />
    <stateAttribute id="stateGhostTest2" useTime="30" attributeName="attributeDuckRate" value="1" restore="1" />
    <stateAttribute id="stateGhostTest2" useTime="30" attributeName="attributeDefenceRate" value="1" restore="1" />
    
    <!--保护: 用于在剧情过程中保护角色别死-->
    <stateGroup id="stateSafe" icon="Interface/skill/shield.jpg" useTime="9999" states="stateSafe1,stateSafe2" />
    <stateAttribute id="stateSafe1" useTime="9999" attributeName="attributeDefence" value="99999" restore="1" />
    <stateAttribute id="stateSafe2" useTime="9999" attributeName="attributeMagicDefence" value="99999" restore="1" />
    
    <!--晕眩: 让目标不能动也不能执行任何技能-->
    <stateSkillLocked id="stateStun" icon="Interface/skill/stun.png" useTime="3" lockAtSkillTags="reset"
                      lockAllSkillTags="1" lockLocation="1" effects="effectStateStun" />

    <!--疾风步: 增加移动速度50% -->
    <stateAttributeMove id="stateWindWalk" icon="Interface/skill/rapidWind.jpg" useTime="60"
                        attributeName="attributeMoveSpeed" value="0.3" restore="1" moveEffect="effectStateWindWalk" />
    
    <!--冰霜: 减速50%-->
    <stateAttribute id="stateSnowFrost" icon="Interface/skill/snow.jpg" useTime="6" 
                        attributeName="attributeMoveSpeed" value="-0.3" restore="1" />
    
    <!--冰冻：6秒冰冻，让角色不能动-->
    <stateSkillLocked id="stateIceFrozen" icon="Interface/skill/ysh_33.jpg" useTime="6" lockAtFrame="1" 
                      lockAllSkillTags="1" lockLocation="1" effects="effectFrozen" />
    
    <!--=====================================================================-->
    <!--魔法：复活术相关状态-->
    <!--=====================================================================-->
    <!--保护角色在复活之前不被移出场景-->
    <!--<stateEssential id="stateRebornEssential" icon="Interface/skill/essential.png" useTime="5" essential="1" restore="1" />-->
    <stateBooleanAttribute id="stateRebornEssential" icon="Interface/skill/essential.png" useTime="5" bindAttribute="attributeEssential" value="1" restore="1" />
    
    <!--复活保护：让角色在刚复活的时候有几秒钟处于受保护状态-->
    <stateGroup id="stateRebornProtect" icon="Interface/skill/shield.jpg" useTime="5" states="stateRebornProtect1,stateRebornProtect2" />
    <stateAttribute id="stateRebornProtect1" useTime="5" attributeName="attributeDefence" value="99999" restore="1" />
    <stateAttribute id="stateRebornProtect2" useTime="5" attributeName="attributeMagicDefence" value="99999" restore="1" />
    
    <!--增加生命值让角色复活-->
    <stateAttribute id="stateRebornAddLife" icon="" useTime="0" 
                          attributeName="attributeHealth" value="100" restore="0" />
    
    <!--让角色处于wait状态-->
    <stateSkill id="stateRebornWait" icon="" useTime="0" skillTags="wait" />
    
    <!--=====================================================================-->
    <!--缠绕状态:蜘蛛的缠绕-->
    <!--=====================================================================-->
    <stateSkillLocked id="stateSpiderWeb" icon="Interface/skill/ysh_48.jpg" useTime="6" lockAtSkillTags="reset"
                        lockSkillTags="walk,run,jump,idle,duck,dance" lockSkillIds="skillDanceSakura,skillDualSwordWave" 
                        lockLocation="1" effects="effectSpiderWeb" />
     
    <!--=====================================================================-->
    <!--狂暴状态:1分钟内提升角色的攻击速度、魔法速度、躲闪、防御、连招-->
    <!--=====================================================================-->
    <stateGroup id="stateSpeedUpAS" icon="Interface/skill/ysh_88.jpg" useTime="60" 
                states="stateSpeedUpAS1,stateSpeedUpAS2,stateSpeedUpAS3,stateSpeedUpAS4,stateSpeedUpAS5" />
    <stateAttribute id="stateSpeedUpAS1" useTime="60" attributeName="attributeAttackSpeed" value="0.5" restore="1" />
    <stateAttribute id="stateSpeedUpAS2" useTime="60" attributeName="attributeMagicSpeed" value="0.5" restore="1" />
    <stateAttribute id="stateSpeedUpAS3" useTime="60" attributeName="attributeDefenceRate" value="0.5" restore="1" />
    <stateAttribute id="stateSpeedUpAS4" useTime="60" attributeName="attributeDuckRate" value="0.5" restore="1" />
    <stateAttribute id="stateSpeedUpAS5" useTime="60" attributeName="attributeGhostRate" value="0.5" restore="1" />
    
    <!--=====================================================================-->
    <!--中毒状态:蝎子毒 -->
    <!--=====================================================================-->
    <stateAttributeDynamic id="stateScorpionVenom" icon="Interface/skill/claw.jpg" useTime="30" attributeName="attributeHealth" 
                           value="-10" interval="3" effects="effectScorpionVenom" removeOnDead="1" bindDeadAttribute="attributeDead" />
    
    <!--=====================================================================-->
    <!--净化状态:牧师的净化技能所用，可以持续净化中毒、诅咒等-->
    <!--=====================================================================-->
    <stateClean id="stateClean" icon="Interface/skill/clean.jpg" useTime="60" states="stateScorpionVenom" />
</root>



